{
  "$schema": "http://json-schema.org/draft-07/schema#",
  "$id": "https://pycodersmod.github.io/MinecraftModTestLauncher/schemas/launcher-config.schema.json",
  "title": "MMTL Launcher Configuration",
  "type": "object",
  "required": ["defaultProfile", "javaHomes", "profiles"],
  "properties": {
    "configVersion": {"type": "integer", "enum": [1, 2]},
    "defaultProfile": {"type": "string", "minLength": 1},
    "javaHomes": {"$ref": "#/$defs/javaHomeMap"},
    "javaHomesByPlatform": {"type": "object", "additionalProperties": {"$ref": "#/$defs/javaHomeMap"}},
    "runtimeRoot": {"type": "string"},
    "profiles": {"type": "object", "minProperties": 1, "additionalProperties": {"$ref": "#/$defs/profile"}}
  },
  "$defs": {
    "javaHomeMap": {
      "type": "object",
      "propertyNames": {"pattern": "^[1-9][0-9]*$"},
      "additionalProperties": {"type": "string"}
    },
    "profile": {
      "type": "object",
      "required": ["project", "mode"],
      "properties": {
        "project": {"type": "string"},
        "linkedProjects": {"type": "array", "items": {"type": "string"}},
        "mode": {"enum": ["Single", "IntegratedLAN", "Dedicated"]},
        "players": {"type": "integer", "minimum": 1},
        "hostUsername": {"type": "string"},
        "clientPrefix": {"type": "string"},
        "hostCheats": {"type": "boolean"},
        "clientPermissionLevel": {"type": "integer", "minimum": 0, "maximum": 4},
        "gameMode": {"enum": ["survival", "creative", "adventure", "spectator"]},
        "difficulty": {"enum": ["peaceful", "easy", "normal", "hard"]},
        "worldName": {"type": "string"},
        "seed": {"type": "string"},
        "newWorld": {"type": "boolean"},
        "resetWorld": {"type": "boolean", "default": false},
        "port": {"oneOf": [{"const": "Auto"}, {"type": "integer", "minimum": 1, "maximum": 65535}]},
        "autoBuild": {"type": "boolean"},
        "cleanBuild": {"type": "boolean"},
        "acceptEula": {"type": "boolean", "default": false},
        "extraMods": {"type": "array", "items": {"type": "string"}},
        "memoryMb": {"type": "integer", "minimum": 1024},
        "hostMemoryMb": {"type": "integer", "minimum": 1024},
        "clientMemoryMb": {"type": "integer", "minimum": 1024},
        "serverMemoryMb": {"type": "integer", "minimum": 1024},
        "resolution": {"type": "string"},
        "guiScale": {"oneOf": [{"enum": [0, 1, 2, 3, 4]}, {"const": "Auto"}]},
        "windowLayout": {"enum": ["Auto", "Tile", "Cascade", "None"]},
        "jvmArgs": {"type": "array", "items": {"type": "string"}},
        "gameArgs": {"type": "array", "items": {"type": "string"}}
      }
    }
  }
}
